{"$defs":{"digest":{"pattern":"^sha256-jcs-v1:[0-9a-f]{64}$","type":"string"},"id":{"maxLength":255,"minLength":1,"type":"string"},"nonnegative":{"maximum":9007199254740991,"minimum":0,"type":"integer"},"positive":{"maximum":9007199254740991,"minimum":1,"type":"integer"},"raw":{"pattern":"^[0-9a-f]{64}$","type":"string"}},"$id":"urn:gew:schema:performance-benchmark-registry:1.0.0","$schema":"https://json-schema.org/draft/2020-12/schema","maxProperties":256,"properties":{"benchmark_cases":{"items":{"maxProperties":256,"properties":{"baseline_source_identity":{"$ref":"#/$defs/id"},"benchmark_case_digest":{"$ref":"#/$defs/digest"},"benchmark_case_id":{"$ref":"#/$defs/id"},"candidate_source_identity":{"$ref":"#/$defs/id"},"command_binding_digest":{"$ref":"#/$defs/digest"},"command_id":{"$ref":"#/$defs/id"},"command_runtime_policy_digest":{"$ref":"#/$defs/digest"},"correctness_policy_id":{"$ref":"#/$defs/id"},"environment_policy_id":{"$ref":"#/$defs/id"},"expected_correctness_digest":{"$ref":"#/$defs/digest"},"fixture_digest":{"$ref":"#/$defs/digest"},"fixture_id":{"$ref":"#/$defs/id"},"parameter_projection":{"additionalProperties":{"minLength":1,"type":"string"},"maxProperties":256,"minProperties":1,"type":"object"},"profile_id":{"const":"performance"},"profile_version":{"const":"1.0.0"},"sample_set_digest":{"$ref":"#/$defs/digest"},"sample_set_id":{"$ref":"#/$defs/id"},"schema_version":{"const":"1.0.0"},"statistics_policy_id":{"$ref":"#/$defs/id"}},"required":["schema_version","benchmark_case_id","profile_id","profile_version","command_id","command_binding_digest","command_runtime_policy_digest","parameter_projection","fixture_id","fixture_digest","sample_set_id","sample_set_digest","baseline_source_identity","candidate_source_identity","correctness_policy_id","expected_correctness_digest","statistics_policy_id","environment_policy_id","benchmark_case_digest"],"type":"object","unevaluatedProperties":false},"maxItems":1024,"minItems":1,"type":"array","uniqueItems":true},"environment_policy":{"maxProperties":256,"properties":{"environment_policy_digest":{"$ref":"#/$defs/digest"},"environment_policy_id":{"$ref":"#/$defs/id"},"required_fingerprint_field_ids":{"items":{"$ref":"#/$defs/id"},"maxItems":1024,"minItems":1,"type":"array","uniqueItems":true},"safe_environment_name_allowlist":{"items":{"type":"string"},"maxItems":1024,"minItems":1,"type":"array","uniqueItems":true}},"required":["environment_policy_id","required_fingerprint_field_ids","safe_environment_name_allowlist","environment_policy_digest"],"type":"object","unevaluatedProperties":false},"registry_digest":{"$ref":"#/$defs/digest"},"registry_id":{"$ref":"#/$defs/id"},"schema_version":{"const":"1.0.0"},"statistics_policies":{"items":{"maxProperties":256,"properties":{"noise_ceiling_denominator":{"$ref":"#/$defs/positive"},"noise_ceiling_numerator":{"$ref":"#/$defs/positive"},"repetition_count":{"maximum":9007199254740991,"minimum":3,"type":"integer"},"rollback_ratio_denominator":{"$ref":"#/$defs/positive"},"rollback_ratio_numerator":{"$ref":"#/$defs/positive"},"statistics_policy_digest":{"$ref":"#/$defs/digest"},"statistics_policy_id":{"$ref":"#/$defs/id"},"target_ratio_denominator":{"$ref":"#/$defs/positive"},"target_ratio_numerator":{"$ref":"#/$defs/positive"},"warmup_count":{"$ref":"#/$defs/nonnegative"}},"required":["statistics_policy_id","warmup_count","repetition_count","noise_ceiling_numerator","noise_ceiling_denominator","target_ratio_numerator","target_ratio_denominator","rollback_ratio_numerator","rollback_ratio_denominator","statistics_policy_digest"],"type":"object","unevaluatedProperties":false},"maxItems":1024,"minItems":1,"type":"array","uniqueItems":true}},"required":["schema_version","registry_id","environment_policy","statistics_policies","benchmark_cases","registry_digest"],"type":"object","unevaluatedProperties":false}
