{"benchmark_cases":[{"baseline_source_identity":"source:performance-baseline-v1","benchmark_case_digest":"sha256-jcs-v1:8351468729ff747bf83fad0fb4c96e579a07f9edd5986f9aa82bf3f2eeb2c3f8","benchmark_case_id":"performance-local-command-v1","candidate_source_identity":"source:performance-candidate-v1","command_binding_digest":"sha256-jcs-v1:a31f2085ce656493269214fade998340c96f4a65cfd95fc10740839921c4ffe2","command_id":"performance.correctness.v1","command_runtime_policy_digest":"sha256-jcs-v1:9547e05b1c92ecbb9d4ce041e56cce3b0751e26c8562d003b10c762fc93f465b","correctness_policy_id":"performance-correctness-v1","environment_policy_id":"performance-environment-exact-v1","expected_correctness_digest":"sha256-jcs-v1:bb4a7208305fc62e0dfade85631ac3c9c098c5b3afdafe8e867ff1768466a625","fixture_digest":"sha256-jcs-v1:4594f3175d1d83c9e3a9b9edb3a2141badf2e4d4b6558a86ae6a1fed9c93a274","fixture_id":"performance-fixture-v1","parameter_projection":{"mode":"correct"},"profile_id":"performance","profile_version":"1.0.0","sample_set_digest":"sha256-jcs-v1:507acfbe3b9c688b04a4e9bd3c7e7a337eba74956dffbdbd9a57510510e38617","sample_set_id":"performance-samples-v1","schema_version":"1.0.0","statistics_policy_id":"performance-statistics-v1"}],"environment_policy":{"environment_policy_digest":"sha256-jcs-v1:654b3d8f72cacef6c8dd4ba718b53f272fbda03da25f053b0b417e6f1e799ace","environment_policy_id":"performance-environment-exact-v1","required_fingerprint_field_ids":["build-attestation","command-binding","command-cwd","command-executable","command-registry","command-runtime-policy","cpu-identity","distribution-root","distribution-version","fixture","fixture-root","installed-distribution","installed-record","locale","logical-cpu-count","machine","os-family","os-release","protected-closure","python-cache-tag","python-executable","python-implementation","python-version","source-attestation","source-history","static-environment","timezone"],"safe_environment_name_allowlist":["LANG","LC_ALL","TZ"]},"registry_digest":"sha256-jcs-v1:d3d19475fe43e6d2dd496e2d1fbc52dd70a2789e63448b182b771e22a3cf8b32","registry_id":"performance-benchmark-registry-v1","schema_version":"1.0.0","statistics_policies":[{"noise_ceiling_denominator":2,"noise_ceiling_numerator":1,"repetition_count":5,"rollback_ratio_denominator":1,"rollback_ratio_numerator":3,"statistics_policy_digest":"sha256-jcs-v1:f2243b639a0682637724f996561c7ec800ec1c16b7d652f640f35db2e640707d","statistics_policy_id":"performance-statistics-v1","target_ratio_denominator":1,"target_ratio_numerator":3,"warmup_count":1}]}
